{
   "id": "ffffffffff9cbbf4465f0ef30033c587-control-4",
   "type": "ControlTest",
   "refUser": "http://207.249.127.162:1234/users/1",
   "omh:body_weight": {
      "value": "89",
      "unit": "kg"
   },
   "omh:body_height": {
      "value": "180",
      "unit": "cm"
   },
   "waistCircumference": {
      "value": "100",
      "unit": "cm"
   },
   "omh:heart_rate": {
      "value": "70",
      "unit": "beats/min"
   },
   "omh:systolic_blood_pressure": {
      "value": "120",
      "unit": "mmHg"
   },
   "omh:diastolic_blood_pressure": {
      "value": "120",
      "unit": "mmHg"
   },
   "dateModified": "2017-01-18T20:45:42.697Z"
}
